{
  "schema": "bividi.calibration.imu.v1",
  "calibration_id": "synthetic-imu-example-v1",
  "created_utc": "2026-09-16T00:00:00+00:00",
  "device": {
    "model": "synthetic-rig",
    "serial": "SYNTHETIC"
  },
  "imu": {
    "model": "ICM-42688-P",
    "frame": "imu",
    "sample_rate_hz_nominal": 600.0,
    "sample_rate_hz_measured": 599.8
  },
  "frames": {
    "handedness": "right",
    "imu_axes": "+X forward, +Y left, +Z up (synthetic example only)"
  },
  "timing": {
    "timestamp_unit": "us",
    "timestamp_counter_bits": 32,
    "effective_rate_hz": 599.8,
    "gap_count": 0,
    "duplicate_count": 0
  },
  "stationary": {
    "sample_count": 60000,
    "duration_s": 100.0,
    "gyroscope_bias_rad_s": [0.001, -0.002, 0.0005],
    "gyroscope_stddev_rad_s": [0.01, 0.01, 0.011],
    "accelerometer_mean_m_s2": [0.0, 0.0, 9.80665],
    "accelerometer_stddev_m_s2": [0.02, 0.02, 0.025]
  },
  "noise": {
    "gyroscope_noise_density_rad_s_sqrt_hz": 0.0002,
    "accelerometer_noise_density_m_s2_sqrt_hz": 0.002,
    "gyroscope_bias_random_walk_rad_s2_sqrt_hz": 0.00002,
    "accelerometer_bias_random_walk_m_s3_sqrt_hz": 0.0002,
    "method": "synthetic example values; not measured hardware"
  },
  "quality": {
    "warnings": [
      "Synthetic example only. Values must never be reused as DECXIN AR0234 specimen calibration."
    ]
  },
  "provenance": {
    "kind": "synthetic",
    "tool": "repository-example"
  }
}
